ID,碑名,建立年,所在地,災害名,災害種別,伝承内容,緯度,経度
08215-006,東日本大震災記録碑,2015,茨城県北茨城市平潟町,東日本大震災（2011年3月11日）,地震・津波,"平成23(2011)年3月11日14時46分、東北地方太平洋沖地震による震度6弱の強い揺れと最大6.7mの津波が北茨城市を襲った。15時31分に到達した津波は、一瞬に死者5名、行方不明者1名の命を奪った。市内の被災家屋は全半壊2,400戸を越えた。碑には当地の津波到達地点6.7mが刻まれている。",36.856137,140.795264
08217-001,決潰口の跡,1955,茨城県取手市大留,洪水（1950年8月7日）,洪水,昭和25年（1950）8月7日、利根川上流での豪雨で利根川の水位が上昇し、小貝川との合流付近で利根川本線からの逆流を受け、小貝川堤防がこの地で約220m決壊した。浸水家屋が低地の農村部全般に及び、また、排水が悪いため湛水期間が長びき、農作物に大きな被害を及ぼした。,35.892744,140.142331
08217-002,竣工記念碑,1985,茨城県取手市大留（八幡神社）,洪水（1950年8月5日）,洪水,昭和10年（1935）9月にこの地の対岸で、昭和16年（1941）7月に対岸の旧川原代村小通幸谷地先で、昭和25年（1950）8月にこの地で、昭和56年（1981）8月に対岸の高須で小貝川の堤防が決壊した。水害を防ぐよう、何度も河川改修工事が行われ、八幡神社と公民館はやむなくこの地に移転となった。,35.893407,140.142119
08217-003,内堤記念碑,1936,茨城県取手市神浦（水神宮）,洪水（1902年）,洪水,明治35年(1902）、未曽有の洪水が発生し、田畑が冠水して食べ物を失った。そこで住民らは、自己の土地を担保にして銀行より資金を借り、耕地に堤防を建設した。,35.891347,140.132815
08217-004,決潰口の跡,1955,茨城県取手市高須,洪水（1935年9月26日）,洪水,"昭和10年(1935)、台風の前面に伴う温暖前線によって起こされた利根川上流山地内での豪雨により利根川の水位が上昇し、逆流によって小貝川の左岸堤防がこの地で決壊した。これによる旧高須村の被害は、浸水面積約10,000ha、浸水家屋4,693戸に及んだ。",35.900373,140.150108
08225-001,築堤記念碑,1952,茨城県常陸大宮市野口,洪水（1938年9月1日、1941年7月22日）,洪水,昭和13年(1938)9月1日と昭和16年(1941)7月22日の豪雨では、天明年間以来の大洪水が発生した。水位は8mに及び、野口地区は濁流に襲われ、耕地は20haが流され、家屋は約30棟が浸水し、被災者は約200名に及んだ。,36.558972,140.310715
08233-001,洪水の碑,1989,茨城県行方市玉造甲地先　,洪水（1938年6月〜7月）,洪水,"昭和13年(1938)6月から7月にかけて、台風の影響を受けた前線による大雨が原因で霞ヶ浦の水位が上昇して洪水が発生。冠水被害は数十日にも及び、死者45人、床上・床下浸水81,739戸の大災害となった。",36.096718,140.401647
08364-001,明治二十三年洪水被害紀念碑,1891,茨城県久慈郡大子町大字池田（国道118号法面）,洪水（1890年8月7日）,洪水,明治23年（1890）8月7日、前日からの大雨により久慈川沿岸は大洪水に見舞われ、吉田神社境内には約1.5mの洪水が押し寄せた。人や家畜が流され、田畑や家屋も流失して大きな被害となった。,36.788301,140.361272
08364-002,可恐（おそるべし）,不明,茨城県久慈郡大子町大字久野瀬111-1（諏訪神社入口）,洪水（1890年8月7日）,洪水,明治23年（1890）年8月7日、久慈川は大洪水に見舞われ、河川の水位は平時と比べて約6m増水し、建立時に碑のあった場所まで浸水した。旧大子村の被害は溺死者4名、流失家屋13棟、浸水家屋250戸余を数え、町家の大半が浸水した。碑は建立時より約1m低い位置に移設されている。,36.761938,140.379607
08364-003,可恐（おそるべし）,不明,茨城県久慈郡大子町大字袋田1972-10,洪水（1890年8月7日）,洪水,明治23年（1890）8月7日、久慈川は未曽有の大洪水に見舞われ、河川の水位は平時と比べて約6.6m増水した。この地域では、田畑約3.7haが流された。旧大子村の被害は溺死者4名、流失家屋13棟、浸水家屋250戸余を数え、町家の大半が浸水した。碑は建立時より高い位置に移設されている。,36.75663,140.379516
09202-001,渡良瀬川とともに,2000,栃木県足利市岩井町,カスリーン台風（1947年）,洪水,"昭和22(1947)年9月14日から15日にかけて接近したカスリーン台風により、関東地方では大水害が発生。死者・行方不明者数は、利根川水系で1,100人にものぼり、そのうち渡良瀬川流域では約3分の2を占める709人、足利市でも319人が犠牲となった。石碑横にはシンボルタワーと市街地から移設された地蔵尊及び供養塔がある。",36.324893,139.462847
09206-001,砂防塔,1970,栃木県日光市所野,洪水・土石流（1902年、他）,洪水・土砂災害,日光の河川は、古くは天長4年（824）、天文年中（1532〜1534）、寛文2年（1662）稲荷川の大洪水や土石流、近くは明治35年（1902）足尾台風など大災害に襲われ、そのたびに周辺の住民は多数の死者を出し、田畑や橋を失うなど甚大な被害を被ってきた。,36.74885,139.631898
09206-002,稲荷川水難供養塔,1663,栃木県日光市日光,洪水・土石流（1662年7月28日）,洪水・土砂災害,寛文2年(1662)6月（旧暦）、大雨により大谷川と稲荷川で大洪水が発生。上流で発生した土砂災害が下流域で大規模な被害をもたらした。赤薙山からは巨礫が流れ出し、当時、山内東側の稲荷川沿いにあった稲荷町を押し流し、死者140人余ともいわれる大惨事となった。,36.746649,139.613916
09206-003,中宮祠小学校　校舎流失慰霊の碑,1983,栃木県日光市中宮祠,足尾台風（1902年9月28日）,土砂災害,明治35年（1902）9月28日、関東一帯を襲った大暴風雨により、中宮祠小学校を土石流が襲った。土石流は校舎もろとも、教師一家3人を中禅寺湖まで押し流し、命を奪った。,36.741589,139.486176
09206-004,震災復興記念碑,1952,栃木県日光市板橋,今市地震（1949年12月26日）,地震,昭和24年（1949）12月26日の明け方に旧今市市で発生した地震により、10名の尊い命が失われた。この地震により、100年以上に渡って住民生活を支えた二宮堀は一瞬にして壊滅し、復旧までに２年かかった。,36.643487,139.724986
09206-005,今市地方震災横死者供養塔,1957,栃木県日光市平ケ崎,今市地震（1949年12月26日）,地震,昭和24年（1949）12月26日の午前8時に旧今市市を中心とした地域は突如強い揺れに襲われ、10名の尊い命と多くの住民の生活基盤を失った。碑には亡くなった10名の住所（集落名）と名前が記されている。,36.710455,139.678724
09206-006,震災記念碑,1950,栃木県日光市今市,今市地震（1949年12月26日）,地震,昭和24年（1949）12月26日午前8時18分、旧今市町を中心とした当時の二町九ヶ村は、強い揺れに襲われた。山は崩れ、大地は裂け、井戸は枯れ、家屋は傾きまた倒れ、人命も奪われた。しかし、町民の協力により火災は起きなかった。,36.724942,139.681162
09206-007,中原用水震災復旧記念碑,1952,栃木県日光市明神,今市地震（1949年12月26日）,地震,昭和24年（1949）12月26日、前例のない地震災害により、トンネルや堰堤（えんてい）、用水堀が全面的に埋没し、多くの住民の生活基盤を失った。関係者の賢明な努力により、5カ月で復旧した。,36.69284,139.709299
09206-008,紡績堀　二宮堀震災復旧紀念碑,1951,栃木県日光市板橋,今市地震（1949年12月26日）,地震,昭和24年（1949）12月26日明け方の大地震により、紡績堀、二宮堀が崩壊し、500haの耕地のかんがい用水を絶たれてしまった。影響は住民1万人あまりに及んだ。関係者の賢明な努力により、復旧工事はわすか1年3ヶ月で完了した。,36.674493,139.723737
09206-009,震災復旧記念碑,1953,栃木県日光市吉沢,今市地震（1949年12月26日）,地震,昭和24年（1949）12月26日午前8時に突如、鳴動と共に激震が襲った。水路は破壊され、農地には亀裂が起こり、道路の被害は甚大となり、人々は生活基盤を失った。このため地区一帯となって協力して復旧工事を進め、2年余りで完成した。,36.708782,139.704096
09206-010,震災記念碑,1950,栃木県日光市山久保,今市地震（1949年12月26日）,地震,昭和24年（1949）12月26日午前8時18分に大地震（今市地震）に襲われ、当時の二町九ヶ村が大被害を被った。山は崩れ、大地は裂け、家屋は傾き、人命も奪われた。しかし、幸いにも火災は起きなかった。ここにある神社も多大な被害を受けた。,36.711363,139.641014
09206-011,震災復興記念,1953,栃木県日光市和泉,今市地震（1949年12月26日）,地震,昭和24年（1949）12月26日午前8時17分、突如として強い揺れに襲われた。山は崩れ、大地は裂け、家屋は傾きまたは倒れ、甚大な被害を受けた。ここにあった神社も被害を受けた。,36.724192,139.664441
09206-012,竣功記念碑,1950,栃木県日光市塩野室町,キティ台風（1949年8月31日〜9月1日）,洪水,昭和24年(1949)8月31日から翌9月1日にかけてのキティ台風は、一夜にして堤防を決壊した。これにより流域約1.5haの保安林が流失し、当集落は浸水した。,36.748646,139.786681
09214-001,竣工記念,1950,栃木県さくら市大中,キティ台風（1949年8月31日〜9月1日）,洪水,昭和24年(1949)8月31日から翌9月1日にかけてのキティ台風により、鬼怒川の堤防が800mに渡って決壊した。濁流に襲われた大中集落は一夜にして鬼怒川の本流のようになった。第2次世界大戦後の5年に満たない間に発生した、4回目となる洪水であった。,36.684682,139.947021
09214-002,東日本大震災復旧復興記念之碑,2013,栃木県さくら市喜連川,東日本大震災（2011年3月11日） 　平成23年台風15号（2011年9月22日）,土砂災害・地震,平成23年（2011）3月11日、東北地方太平洋沖地震が発生した。震度5強を観測したさくら市では全壊2棟を含む2547棟が被害を受け、お丸山南斜面では東西630mにわたり亀裂が生じ、24世帯に避難勧告が発令された。さらに、同年9月22日、台風15号の豪雨により、お丸山南側が幅50m、長さ100mにわたり崩落し、計61世帯156名に避難勧告が発令され、2年間継続された。,36.717771,140.021146
09343-001,逆川に大洪水あり,不明,栃木県芳賀郡茂木町大字小井戸,台風第10号（1986年）,洪水,"昭和61(1986)年8月4日夜半から5日未明にかけて、東日本を襲った台風10号による集中豪雨のため、逆川流域の茂木町市街地は、一夜のうちに水没し、浸水面積110ha、浸水家屋1,200戸という大きな被害を受けた。碑には当時の洪水位が記されている。",36.534691,140.186173
09343-002,逆川改修記念碑,1990,栃木県芳賀郡茂木町大字飯,台風第10号（1986年）,洪水,昭和61(1986)年8月5日未明、台風10号による豪雨のため、逆川流域は有史以来の大水害を被った。碑の近くには、当時の洪水位を記した洪水痕跡碑が設置されている。,36.481315,140.164009
09407-001,三蔵川災害復旧助成事業竣工記念,2003,栃木県那須郡那須町大字伊王野444,洪水（1999年7月13日）,洪水,平成11年（1999）7月11日明け方からの梅雨前線に伴う降雨は、同月15日まで続き、三蔵川等で大洪水が発生した。被害は、那須町から旧黒羽町にかけて広範囲に及び、家屋流失7戸、床上浸水40戸、床下浸水8戸、農地流失及び土砂堆積、橋梁流失及び道路崩落など多大な被害をもたらした。,36.954993,140.156786
09407-002,余笹川災害復旧事業竣工の碑,2001,栃木県那須郡那須町大字寺子乙2584-6,平成10年8月末豪雨（那須豪雨）（1998年8月27日）,洪水,平成10年（1998）8月26日から31日にかけて、栃木県北東部や福島県南部で局地的な豪雨となった。この豪雨で那珂川上流域の余笹川・黒川・四ツ川では河岸の8割以上が決壊した。被害は栃木県那須町・黒磯市を中心に広範囲に及び、栃木県内の死者は5名、行方不明者2名、家屋の全壊、半壊、浸水は2977棟に及んだ。この碑のそばには、当時の被災水位を示した碑も設置されている。,37.017882,140.111936
09407-003,追悼之碑（山津波の碑）,1907,栃木県那須郡那須町大字湯本178-9,洪水・土石流（1858年7月24日）,洪水・土砂災害,安政5年6月（1858年7月）、大雨は10日余り降りつづき、6月14日（7月24日）の夜には降り続いた長雨により、山は崩れ、谷川は氾濫した。家屋全戸が損傷又は流失し、18名の尊い命が奪われた。その後、災害をまぬがれた住民は南側の岡へ移住し、温泉を引き、今の湯本を築いた。,37.097833,140.001266
09407-004,那須水害復興の碑,2004,栃木県那須郡那須町大字寺子乙4578,平成10年8月末豪雨（那須豪雨）（1998年8月27日）,洪水,平成10（1998）年8月26日から27日未明にかけて那須北部を襲った局地的な集中豪雨で余笹川が氾濫。当地区では下余笹橋附近と下川橋下流が決壊、住宅6戸が床上浸水、納屋6棟や農機具等が流失、収穫目前の水田が冠水・流失、墓地までも流失する甚大な被害となった。,37.002784,140.113473
09407-005,黒川災害復旧助成事業竣工の碑,2002,栃木県那須郡那須町大字梁瀬404,平成10年8月末豪雨（那須豪雨）（1998年8月27日）,洪水・土砂災害・地震,平成10年（1998）8月26日から31日にかけて、栃木県北東部や福島県南部で局地的な豪雨となった。この豪雨で那珂川上流域の余笹川・黒川・四ツ川では河岸の8割以上が決壊した。被害は栃木県那須町・黒磯市を中心に広範囲に及び、栃木県内の死者は5名、行方不明者2名、家屋の全壊、半壊、浸水は2977棟に及んだ。この碑のそばには、当時の被災水位を示した碑も設置されている。,36.94255,140.14
09407-006,四ツ川災害復旧助成事業竣工の碑,2002,栃木県那須郡那須町大字漆塚660-7,平成10年8月末豪雨（那須豪雨）（1998年8月27日）,洪水,"平成10年（1998）8月26日、台風4号に刺激された前線により、那須地区は集中豪雨に襲われた。27日午前1時から2時の1時間に90mm、6日間降り続いた雨は1,254mmを記録し、県内観測史上例を見ない大雨となった。豪雨による被害は那須地区の広範囲に及び、四ツ川の氾濫により沿川の家屋7戸が流失し、35戸が床上浸水、15戸が床下浸水、農地22haが河原と化し、町道橋が3橋流失した。",37.034587,140.091155
09407-007,黒川災害復旧助成事業竣工記念,2002,栃木県那須郡那須町大字豊原乙3537,平成10年8月末豪雨（那須豪雨）（1998年8月27日）,洪水,"平成10年（1998）8月26日夜半、栃木県北部を襲った集中豪雨は、6日間で1,254mm、最大1時間降雨量90mmを記録した。27日未明には黒川が氾濫し、稲穂が実った水田は上流からの大木や石で覆い尽くされた。黒川氾濫による綱子地区の被害は、県道那須西郷線の流失約70m、床上浸水2棟、床下浸水6棟、田畑約17haが流失し河原となった。住民は、夕狩公民館で7日間の避難所生活を強いられた。",37.113888,140.112817
09407-008,那須の大水害から蘇る水田,2004,栃木県那須郡那須町大字寺子乙3625-1,平成10年8月末豪雨（那須豪雨）（1998年8月27日）,洪水,平成10年(1998)年8月、栃木県と福島県境付近を中心に記録的な大雨となった。那珂川の左支川余笹川などの氾濫により、那須町では死者・行方不明者5人、流失・全半壊家屋70棟、床上浸水153棟などの被害が発生し、農業関係の被害は農地629.5haに及んだ。,36.99942,140.113864
09407-009,なら沢川河川改修之碑,1979,栃木県那須郡那須町大字高久甲1064-9,洪水（1977年9月3日）,洪水,昭和52年（1977）9月3日夕刻、黒磯市及び那須町は、すさまじい雷鳴を伴う5時間に渡る集中豪雨に見舞われた。この豪雨により過去に類をみない流失家屋を含む先代未曾有の大被害を被った。,37.00073,140.062017
09407-010,高野川改修記念碑,1980,栃木県那須郡那須町大字高久甲980-7,洪水（1977年9月3日）,洪水,昭和52年（1977）9月3日夕刻、黒磯市及び那須町は、すさまじい雷鳴を伴う5時間に渡る集中豪雨に見舞われた。この豪雨により過去に類をみない家屋田畑を流失する先代未曾有の大被害を被った。,36.996481,140.058598
09407-011,余笹川上流域砂防事業竣工記念,2002,栃木県那須郡那須町大字大島,平成10年8月末豪雨（那須豪雨）（1998年8月27日）,洪水,"平成10年（1998）8月26日夜半からの雨は、台風4号に刺激され活発化した前線の影響により栃木県北東部や福島県南部の地域で、局地的豪雨となり、31日までの総雨量は1,254mmを記録するなど、観測史上例をみない大雨となった。大雨被害は、那須町・黒磯市を中心に広範囲に及び、県内の死者5名、行方不明者2名、家屋の全壊、半壊、浸水は2,977棟に及んだ。また、余笹川の上流域の山地及び渓岸が崩壊、膨大な流木を伴う土砂が流出し、下流域に未曾有の被害をもたらした。",37.102002,140.064148
09407-012,災害復興記念碑,2000,栃木県那須郡那須町大字豊原乙3461,平成10年8月末豪雨（那須豪雨）（1998年8月27日）,洪水,"平成10年(1998)年8月26日から31日にかけて、年間降雨量の3分の2にあたる1,254mmという記録的な集中豪雨が那須町を襲い、那須町は未曽有の大災害を受けた。七曲地区においても黒川の氾濫により、田畑、橋が流失した。町より避難勧告が出され、9世帯46人が8月28日より1週間の避難生活をしいられた。",37.088698,140.153565
09407-013,三蔵川河川工事記念碑,1995,栃木県那須郡那須町大字大畑,昭和13年洪水（1938年6月30日） 洪水（1941年7月31日）,洪水,古くから、三蔵川は度々洪水に見舞われた。特に昭和13年（1938）6月30日、同16年（1941）7月31日には豪雨による大洪水に合い、尊い水の犠牲者を出すと共に流域一帯の田畑及び建造物が大きな被害を受けた。,36.984399,140.211621
09407-014,水とともに,2003,栃木県那須郡那須町大字寺子乙（余笹川ふれあい公園）,平成10年8月末豪雨（那須豪雨）（1998年8月27日） 洪水（1999年7月13日）,洪水,那須町は平成10年(1998)・11年(1999)に集中豪雨に襲われ、町内全域に死傷者、家屋流失・全半壊、床上浸水など、甚大な被害が発生した。怒濤と化した水は、行く手を阻むものを全て呑み込む。この災害が、時の流れとともに人々の記憶から忘れられてはならず、その教えを後世に残さなければならないと碑に記されている。,37.017201,140.112473
09407-015,苦戸川用水土地改良区災害復旧竣工記念碑,2002,栃木県那須郡那須町大字高久丙,平成10年8月末豪雨（那須豪雨）（1998年8月27日）,洪水,平成10年(1998)年8月26日から数日間に渡り那須町全域が集中豪雨に襲われ、これまでにない大被害を受けた。苦戸川用水土地改良区の用水路は、堰口より終点までの二十数キロメートルで数十箇所の被害を受け、特に四ツ川を横断する鉄管及び併行する用水路は約200メートルが洪水によって流された。,37.043883,140.055993
10201-001,水害記念,1957,群馬県前橋市河原浜町,カスリーン台風（1947年9月15日）,洪水・土砂災害,昭和22年(1947)9月15日、群馬県にカスリーン台風が襲来し、前橋では14日から15日にかけて約400mmの豪雨となった。15日の午後、荒砥川では2メートルの土石流が発生し旧大胡町の根古屋地区を襲い集落は流失した。旧大胡町では死者71名、家屋流失124戸、倒壊半壊98戸、埋没冠水田畑約330ヘクタール等の被害となった。,36.419773,139.15958
10201-002,慰霊の碑,1998,群馬県前橋市富士見町小沢,カスリーン台風（1947年9月15日）,洪水・土砂災害,昭和22年(1947)9月15日、群馬県をカスリーン台風が襲った。連日の雨は15日朝から一層激しく降り、赤城白川の水量は急激に増した。午後4時頃、右岸4箇所の堤防が決壊し、土石流が小沢、原之郷地区をのみ込んだ。旧富士見村では死者104名、その他に家屋や田畑も大きな被害を受けた。,36.444796,139.079458
10201-003,供養塔,1784,群馬県前橋市総社町植野（元景寺）,天明3年浅間山噴火に伴う天明泥流（1783年8月5日）,火山災害,浅間山は天明3年4月(1783年5月)から活動期に入り、7月8日（旧暦）に大爆発を起した。この影響で大量の溶岩流や火砕流が流出し、河川に流れ込み泥流となって、村々を襲った。旧総社町近くの利根川には上流から流れてきた遺体であふれ目も当てられぬ状況であった。当碑は遺体を埋葬した勝山地区に建立されていたが、災害で流失する危険があったため、現在地に移設された。,36.414581,139.040077
10201-004,災害復旧記念碑,1960,群馬県前橋市富士見町原之郷,カスリーン台風（1947年9月15日）,洪水・土砂災害,昭和22年(1947)9月15日、カスリーン台風がもたらした雨の影響で、赤城白川の上流で山腹崩壊が起きたために土石流が発生した。高さ約3メートルの土石流は午後4時頃、下流の旧富士見村や旧南橘村を襲った。旧富士見村では死者104名、その他に家屋や田畑も大きな被害を受けた。,36.436348,139.068825
10201-005,供養塔,1948,群馬県前橋市富士見町原之郷,カスリーン台風（1947年9月15日）,洪水・土砂災害,昭和22年(1947)9月15日、カスリーン台風がもたらした雨は、前橋地方で370mm、赤城地方で600mmにもおよんだ。この影響で赤城山西麓で土石流が発生し、流下した赤城白川の各所で氾濫が発生して、旧富士見村の原東地区では死者54名、流失家屋17戸、田畑の流失22ヘクタールの被害となった。,36.436223,139.069469
10201-006,災害復旧記念,不明,群馬県前橋市富士見町小沢,カスリーン台風（1947年9月15日）,洪水・土砂災害,昭和22年(1947)9月15日、カスリーン台風がもたらした雨の影響で、赤城白川の上流で山腹崩壊が起きたために土石流が発生した。高さ約3メートルの土石流は午後4時頃、下流の旧富士見村を襲った。細ヶ沢川、法華沢川、藤沢川でも被害が発生し、旧富士見村では死者104名、その他に家屋や田畑も大きな被害を受けた。,36.45186,139.085852
10202-001,七士殉職供養塔,1935,群馬県高崎市片岡町二丁目,昭和10年台風10号（1935年9月24〜25日）,洪水,昭和10年(1935)9月24から25日、台風10号の影響で上信地方は豪雨となった。この豪雨の影響で高崎市では烏川・碓氷川の堤防が決壊し死者7名、家屋流失6棟、全壊3棟、半壊4棟、床上浸水818棟、床下浸水712棟の被害が発生し、救護活動に従事した十五連隊兵士10名のうち7名が殉職した。,36.315231,138.998345
10203-001,水害殉難者供養塔,1948,群馬県桐生市新宿3丁目7-32定善寺境内,カスリーン台風(1947年9月）,洪水・土砂災害,昭和22年(1947)9月、カスリーン台風が関東地方に接近して、群馬県に記録的な豪雨をもたらした。なかでも渡良瀬川流域では、赤城、足尾山地で土石流が発生し、桐生市では死者146名、住家流失213戸等の甚大な被害となった。碑には桐生市で殉難した方の名前が刻まれている。,36.395318,139.34218
