ID,碑名,建立年,所在地,災害名,災害種別,伝承内容,緯度,経度
31202-003,兼久堤防改修記念碑,1921,鳥取県米子市兼久,洪水（1918年9月13日）,洪水,難攻不落と言われた法勝寺川兼久堤防の明治29年(1896)の大改修だったが、大正7年（1918）9月の台風による暴風雨で約110m決壊して大洪水となり、地元をはじめ旧米子町の約四千の家屋が浸水の被害を受けた。このため鳥取県は抜本的な堤防改修を行った。,35.4074,133.362479
31364-001,片柴村水死十五人墓,1762,鳥取県東伯郡三朝町大字片柴,三朝町増野の山崩れ（1762年9月3日）,洪水・土砂災害,宝暦12年7月15日（1762年9月3日）、大雨により三朝町片柴増野で山崩れがあり、人家数戸が被害に遭い圧死者も発生した。碑名は大洪水に由来するので「水死」となっている。,35.410321,133.9095
32202-001,漸に杜ぎ、萠に防ぐ（ぜんにふさぎ、ぼうにふせぐ）,1987,島根県浜田市穂出町,昭和58年7月豪雨（1983年7月23日),土砂災害,昭和58年(1983)7月23日、梅雨前線による豪雨により各所で山崩れが発生した。中場地区でも山が崩れ、死者15名、全壊家屋８戸の被害を受けた。,34.850461,132.038745
32202-002,震災紀念之碑,1896,島根県浜田市牛市町,浜田地震（1872年3月14日）,地震,明治5年2月6日（1872年3月14日）、浜田市沖を震源とする大地震により、浜田市街では地は裂けて家屋は倒壊、火災があちこちで発生し、多くの死傷者が出た。牛市町では家屋83戸が倒壊・焼失し、人口300人余りのうち、死者42名、負傷者100名余りの被害を受けた。,34.899496,132.084283
32202-003,静流の鐘塔,1989,島根県浜田市三隅町古市場,昭和58年７月豪雨（1983年7月23日）,洪水・土砂災害,昭和58年(1983)7月23日、降り続いた豪雨は650mmに達して三隅川を始め各支流が氾濫し、家々や道路や橋が押し流された。また、膨大な土石流が人家を襲い、田畑は埋まり、多くの施設が破壊された。この未曽有の大災害により、三隅町全域で33名の尊い命が奪われた。,34.787712,131.956852
32202-004,五十八年山陰豪雨災害追悼之碑,2002,島根県浜田市三隅町岡見,昭和58年７月豪雨（1983年7月23日）,洪水・土砂災害,昭和58年(1983)7月23日早朝6時少し過ぎ、降り続いた局地的豪雨により、観音山で大規模な山崩れが発生し、住宅5戸がおしつぶされ、一瞬のうちに13名もの尊い命が奪われた。,34.773276,131.915352
32203-001,（洪水）伝承碑,1895,島根県出雲市船津町,洪水（1873年、1893年、1894年）,洪水,"明治6年(1873),26年(1893),27年(1894)と連続した水害に見舞われた地区民が以後の安全を祈り明治28年(1895)に建立した。",35.343292,132.812353
32203-002,（洪水）伝承碑,1895,島根県出雲市船津町,洪水（1873年、1893年、1894年）,洪水,"明治6年(1873),26年(1893),27年(1894)と連続した水害に見舞われた地区民が以後の安全を祈り明治28年(1895)に建立した。",35.344055,132.799866
32204-001,防災祈念碑,1984,島根県益田市本町7−17（益田小学校敷地内）,昭和58年7月豪雨（1983年7月23日）,洪水,昭和58年（1983）7月20日から23日にかけて降り続いた豪雨により益田川が氾濫した。この未曾有の大水害により旧益田市では死者32人、床上浸水3916戸など壊滅的な被害を被った。,34.677291,131.860601
32204-002,松崎の碑,1814,島根県益田市高津五丁目（金刀比羅神社・恵美須神社境内）,津波（1026年）,津波,万寿3年（1026）、地震による大津波で高津沖にあった鴨島が水没するなど大きな被害を被った。,34.686386,131.821278
32205-001,水難横死者追悼碑,1949,島根県大田市仁摩町大国1057-2,洪水・山崩れ（1943年9月20日）,洪水・土砂災害,昭和18年（1943）9月20日、前日から降り続いた豪雨により石見地方に大災害が発生した。旧大国村でも潮川が氾濫。10日前に発生した鳥取大地震で地盤が緩んでいたこともあり、一帯は田畑の流出、家屋崩壊が発生し、23名の犠牲者が出た。,35.127512,132.425514
32205-002,水害復旧記念碑,1958,島根県大田市川合町川合,洪水(1943年9月20日),洪水,昭和18年（1943）9月20日に襲った台風による大雨で、石見地方の河川が氾濫して大洪水が発生した。一夜にして山を崩し、堤防や橋を壊し、人命をも奪う災害となった。島根県下で死者行方不明者412人、全壊流失家屋7739棟の被害記録がある。,35.156464,132.506817
32205-003,溺死追善塔,1856,島根県大田市久利町久利388-1（専徳寺）,洪水（1851年7月18日),洪水,嘉永4年6月20日（1851年7月18日）、石見地方は大雨となり、旧久利村では洪水により20名余りの人が溺死し、50軒の家屋に被害があった。,35.15574,132.47793
32441-001,不可遺忘之紀（いぼうすべからずのき）,1854,島根県邑智郡川本町大字川本(金比羅山),洪水（1850年7月9日、13日）,洪水,嘉永3年6月1日(1850年7月9日)夜の大洪水で、江川の水は見る間に約12mも増水し、町の大半が流失し、多くの田畑が被災した。7月13日にも洪水があった。碑には当時の代官が困窮の人々を救済したことへの感謝が記されている。元天神町に建てられていたものを1969年に工事のためここに移した。,34.988411,132.492306
33100-001,昭和九年九月二十一日洪水浸水線,1934,岡山県岡山市弓之町14-23（就実中学高等学校）,室戸台風（1934年9月21日）,洪水,"昭和9年（1934）9月21日、岡山県を通過した室戸台風は県下にかつてないほどの大災害をもたらした。旭川、吉井川が決壊し、県内で建物全半壊3,417戸、死者行方不明者152名、負傷者420名、岡山市域でも死者18名、全半壊1,281戸など大きな被害が出た。市内各所に洪水水位を示す標識が設置された（本標識は1972年に移設）。",34.671112,133.929638
33100-002,昭和九年九月二十一日洪水浸水線,1934,岡山県岡山市北区丸の内一丁目15-20（中国銀行本店）,室戸台風（1934年9月21日）,洪水,"昭和9年（1934）9月21日、岡山県を通過した室戸台風は県下にかつてないほどの大災害をもたらした。旭川、吉井川が決壊し、県内で建物全半壊3,417戸、死者行方不明者152名、負傷者420名、岡山市域でも死者18名、全半壊1,281戸など大きな被害が出た。市内各所に洪水水位を示す標識が設置された。",34.662412,133.930641
33100-003,昭和九年九月二十一日洪水浸水線,1934,岡山県岡山市中区徳吉町一丁目1-21（市立三勲小学校 ）,室戸台風（1934年9月21日）,洪水,"昭和9年（1934）9月21日、岡山県を通過した室戸台風は県下にかつてないほどの大災害をもたらした。旭川、吉井川が決壊し、県内で建物全半壊3,417戸、死者行方不明者152名、負傷者420名、岡山市域でも死者18名、全半壊1,281戸など大きな被害が出た。市内各所に洪水水位を示す標識が設置された。",34.659239,133.941075
33100-004,昭和九年九月二十一日洪水浸水線,1934,岡山県岡山市北区後楽園（岡山後楽園）,室戸台風（1934年9月21日）,洪水,"昭和9年（1934）9月21日、岡山県を通過した室戸台風は県下にかつてないほどの大災害をもたらした。旭川、吉井川が決壊し、県内で建物全半壊3,417戸、死者行方不明者152名、負傷者420名、岡山市域でも死者18名、全半壊1,281戸など大きな被害が出た。市内各所に洪水水位を示す標識が設置された（本標識は1972年に移設）。",34.668297,133.934342
33100-005,昭和九年九月二十一日洪水浸水線,1934,岡山県岡山市北区丸の内2丁目（岡山城）,室戸台風（1934年9月21日）,洪水,"昭和9年（1934）9月21日、岡山県を通過した室戸台風は県下にかつてないほどの大災害をもたらした。旭川、吉井川が決壊し、県内で建物全半壊3,417戸、死者行方不明者152名、負傷者420名、岡山市域でも死者18名、全半壊1,281戸など大きな被害が出た。市内各所に洪水水位を示す標識が設置された。",34.663959,133.935027
33100-006,昭和9年9月21日　洪水浸水線,2007,岡山県岡山市北区表町2丁目1-1（天満屋岡山本店）,室戸台風（1934年9月21日）,洪水,"昭和9年（1934）9月21日、岡山県を通過した室戸台風は県下にかつてないほどの大災害をもたらした。旭川、吉井川が決壊し、県内で建物全半壊3,417戸、死者行方不明者152名、負傷者420名、岡山市域でも死者18名、全半壊1,281戸など大きな被害が出た。本標識は2007年に新たに設置された。",34.661313,133.929176
33100-007,昭和九年九月二十一日洪水浸水線,1934,岡山県岡山市北区中山下1丁目8-45（NTTクレド岡山）,室戸台風（1934年9月21日）,洪水,"昭和9年（1934）9月21日、岡山県を通過した室戸台風は県下にかつてないほどの大災害をもたらした。旭川、吉井川が決壊し、県内で建物全半壊3,417戸、死者行方不明者152名、負傷者420名、岡山市域でも死者18名、全半壊1,281戸など大きな被害が出た。市内各所に洪水水位を示す標識が設置された（本標識は1999年に復元設置）。",34.66261,133.926489
33202-001,明治26年大洪水供養塔,1929,岡山県倉敷市真備町川辺　源福寺敷地内,大洪水（1893年10月12日13日）,洪水,明治26年（1893）10月12日13日、台風襲来による大洪水のため、高梁川右岸の秦・富原・下原と川辺の渡し上流50mの神楽土手が決壊。小田川でも坪田・外和崎などが決壊。死者は2百余名と伝えられた。供養塔は、その頭部が当時の水位となるように建立された。,34.640043,133.717877
33202-002,台風17号による浸水,1978,岡山県倉敷市真備町川辺　川辺小学校敷地内,浸水（1976年9月12日）,洪水,昭和51年（1976）9月12日、台風17号により広い地域で浸水被害をもたらした。,34.639345,133.722281
33202-003,千人塚合葬之碑,1885,岡山県倉敷市広江町２丁目,高潮（1884年8月25日）,高潮,明治17年（1884）8月25日、台風による強風で水島灘からの激しい大波と高潮により、福田新田の干拓堤防が決壊し、福田地区（北畝・中畝・東塚・南畝・松江）で高潮による浸水被害が広範囲に発生した。破壊流失した家屋742戸、犠牲者536人。,34.525497,133.772785
33202-004,平成30年7月豪雨災害の碑,2019,岡山県倉敷市真備町箭田,平成30年7月豪雨（西日本豪雨）（2018年7月5日〜7日）,洪水,"平成30年（2018）7月5日から7日に降り続いた豪雨により、小田川・末政川・高馬川・真谷川の8箇所で堤防が決壊、小田川・大武谷川の7箇所で一部損壊・損傷し、真備地区の約三割、1,200ヘクタールが浸水する大洪水となった。5,700棟超の住家が全壊・大規模半壊等し、60名を超える命が奪われた。",34.629337,133.691911
33202-005,番東池決壊之碑,1973,岡山県倉敷市児島唐琴町,ため池決壊（1972年9月19日）,洪水・その他,昭和47年（1972）9月19日午前11時50分、絶好の秋日和のなか、仲池及び番東池が突然決壊し、唐琴町を襲った。罹災家屋150数戸、死者1名、負傷者10名、全壊家屋や機器家具類の流失浸水により莫大な損害を被った。かつて明和9年8月21日（1772年9月18日）夜半に、仲池、二ツ池が決壊し、死者5名が出たとの記録もある。,34.473816,133.860788
33202-006,平成30年7月　豪雨災害の碑,2021,岡山県倉敷市真備町川辺（倉敷市真備公民館川辺分館）,平成30年7月豪雨（西日本豪雨）（2018年7月5日〜7日）,洪水,平成30年（2018）7月5日から7日に降り続いた記録的な大雨により末政川の堤防が決壊し、川辺地区1734世帯のほぼ全ての家が浸水被害を受け、住民6名の尊い命が失われた。浸水位は、川辺地区全体でおおむね3.5ｍに達し、明治26年（1893）以来の大災害となった。,34.639325,133.722748
33208-001,水災溺死者之墓,不明（1893頃）,岡山県総社市井尻野字湛井,明治26年大洪水（1893年10月14日）,洪水,明治26年（1893）10月11日から降り始めた豪雨は、13日に台風接近に伴い暴風雨となり、14日にピークを迎え、高梁川流域の多くの場所で堤防が決壊して甚大な被害が発生した。特に湛井堰下流左岸堤防の決壊では、影響は吉備津付近まで及び、湛井堰近郊だけで160人余りの命が奪われた。,34.691475,133.729105
33210-001,明治19年洪水の水位碑,1888,岡山県新見市草間,明治19年洪水（1886年9月24日）,洪水,明治19年(1886)9月24日、暴風雨によって高梁川などが氾濫し、川沿いの集落の多くが水没した。旧阿賀郡では死者11名、流失家屋45戸、倒壊家屋192戸の被害が生じた。碑の上部には、洪水の水位が刻まれている。,34.91982,133.523734
33606-001,洪水紀念碑,1903,岡山県苫田郡鏡野町宗枝,第一水害・第二水害（1892年7月23日・1893年10月13日）,洪水,明治25年（1892）7月23日と翌26年（1893）10月13日に吉井川が氾濫し、宗枝、古川地内で堤防決壊約1q、農地冠水約7ha、家屋流失3棟と甚大な被害が発生した。,35.080066,133.921387
33606-002,慰霊碑,1972,岡山県苫田郡鏡野町上森原750-2,極楽寺池の決壊(1945年9月17日),洪水・その他,昭和20年(1945)9月17日、枕崎台風による豪雨で昭和18年（1943）に新設された極楽寺池が決壊して大洪水となった。旧小田村及び旧中谷村で田畑の流失60ヘクタール、家屋建物の倒壊流失20棟以上、46名が死亡又は行方不明となった。,35.131739,133.925443
33623-001,昭和三十八年豪雨災害復興紀念碑,1972,岡山県勝田郡奈義町関本(三穂神社敷地内),洪水（1963年7月11日）,洪水,昭和38年（1963）7月10日夜から翌11日正午の間に美作東部、特に梶並川流域で集中豪雨となり、降雨量が216.9mmに達した。奈義町では、馬桑川、淀川、高殿川、名義川、滝川、岩倉川が鉄砲水となり増水氾濫し、護岸を決壊し水田を押し流し、1名の命が奪われ、10億円の被害となった。,35.138119,134.206535
34100-001,水害之碑,1909,広島県広島市安芸区矢野東五丁目（矢野東集会所付近）,洪水・土石流（1907年7月15日）,洪水・土砂災害,明治40年(1907）7月15日に発生した豪雨災害について、発生前の村の様子、地理的位置、後世に伝えるべきという石碑建立の意図などが記されている。[関連外部サイトへのリンク集 ](https://www.gsi.go.jp/bousaichiri/denshouhi_links.html#hiroshima),34.353289,132.536019
34100-002,災害の碑,1919,広島県広島市安佐南区相田二丁目（相田集会所敷地内）,洪水（1916年9月6日）,洪水,大正5年（1916）9月6日に起きた安川の洪水災害について、多くの金銭的・人的支援、県知事や村長、県会議員の指揮で村民が奮起したことや石碑建立の経緯や意図も述べられている。[関連外部サイトへのリンク集 ](https://www.gsi.go.jp/bousaichiri/denshouhi_links.html#hiroshima),34.473169,132.450881
34100-003,水害碑,1930,広島県広島市東区温品七丁目（府中大川沿い、八幡端西詰）,洪水・土石流（1926年9月11日）,洪水・土砂災害,大正15年（1926）9月11日の集中豪雨により発生した洪水・土石流による被災の様子や被害状況が漢文で記されている。[関連外部サイトへのリンク集 ](https://www.gsi.go.jp/bousaichiri/denshouhi_links.html#hiroshima),34.414131,132.5108
34100-004,畑賀村水害碑,1930,広島県広島市安芸区畑賀三丁目（畑賀小学校敷地内）,洪水・土石流（1926年9月11日）,洪水・土砂災害,大正15年（1926）9月11日の集中豪雨により発生した洪水・土石流災害について、地理的位置や犠牲者の名前などを碑に刻み、災害の様子や復興の過程を後世に伝えている。[関連外部サイトへのリンク集 ](https://www.gsi.go.jp/bousaichiri/denshouhi_links.html#hiroshima),34.394511,132.550531
34100-005,水害記念碑,1935,広島県広島市安芸区中野一丁目（畑賀川沿い）,洪水・土石流（1926年9月11日）,洪水・土砂災害,大正15年（1926）9月11日の集中豪雨により発生した洪水・土石流などの水害の復旧工事完了を記念して建立され、工事にあたった耕地整理組合員の名前も記されている。[関連外部サイトへのリンク集 ](https://www.gsi.go.jp/bousaichiri/denshouhi_links.html#hiroshima),34.385561,132.5579
34100-006,鉄道遭難者追弔塔,1927,広島県広島市安芸区中野三丁目（専念寺境内）,洪水・土石流（1926年9月23日）,洪水・土砂災害,大正15年（1926）9月23日の集中豪雨により発生した洪水・土石流が原因で起きた鉄道事故の犠牲者を弔うために建立され、表面に名前などが刻まれている。[関連外部サイトへのリンク集 ](https://www.gsi.go.jp/bousaichiri/denshouhi_links.html#hiroshima),34.392966,132.56409
34100-007,瀬川卯一翁彰徳碑,1943,広島県広島市安佐南区山本七丁目（平山神社ちびっこ広場付近）,洪水・土石流（1926年）（1928年）,洪水・土砂災害,大正15年（1926）及び昭和3年（1928）の集中豪雨により発生した洪水・土石流災害の原因と被害状況、発生時に山本村長だった瀬川氏の復興に対する功績が記されている。[関連外部サイトへのリンク集 ](https://www.gsi.go.jp/bousaichiri/denshouhi_links.html#hiroshima),34.438661,132.44365
34100-008,水害紀念碑,1930,広島県広島市安佐北区可部二丁目（品窮寺境内）,洪水（1928年6月24日）,洪水,昭和3年（1928)6月24日、太田川支流の根の谷川の氾濫により，可部の市街地で洪水が発生し、市街地にある品窮寺境内に氾濫した水が流れ、深さ約４尺（120cm）浸水したと刻まれている。[関連外部サイトへのリンク集 ](https://www.gsi.go.jp/bousaichiri/denshouhi_links.html#hiroshima),34.515161,132.512469
34100-009,伴安水災復興碑,1933,広島県広島市安佐南区長楽寺二丁目（ヌマジ交通ミュージアム付近）,土石流（1928年6月24日）,土砂災害,昭和3年（1928)6月24日の土石流災害発生時の気象条件、被害状況、復興の過程や、災害への心構えなどを伝えている。[関連外部サイトへのリンク集 ](https://www.gsi.go.jp/bousaichiri/denshouhi_links.html#hiroshima),34.470061,132.43015
34100-010,慰霊碑,1957,広島県広島市佐伯区湯来町大字麦谷（下井谷橋南詰西側）,洪水・土石流（1951年10月14日）,洪水・土砂災害,昭和26年(1951)10月14日に発生したルース台風による犠牲者の名前や年齢を碑に刻み、二度と災害が起こらないよう祈念して建立された。[関連外部サイトへのリンク集 ](https://www.gsi.go.jp/bousaichiri/denshouhi_links.html#hiroshima),34.516647,132.3127
34100-011,ルース台風を偲ぶ,1992,広島県広島市佐伯区湯来町大字麦谷（湯来農村環境改善センター敷地内）,洪水・土石流（1951年10月14日）,洪水・土砂災害,昭和26年(1951)10月14日に発生したルース台風により洪水を起こした水内川流域で再び災害が起きないことを祈念し、災害から41年を経て建立された。[関連外部サイトへのリンク集 ](https://www.gsi.go.jp/bousaichiri/denshouhi_links.html#hiroshima),34.523869,132.3129
34100-012,慰霊碑,1966,広島県広島市南区段原南一丁目（段原南第三公園内）,土石流（1965年6月20日）,土砂災害,昭和40年(1965)6月20日に発生した山崩れにより犠牲となった方を慰霊するため、比治山のふもとにある公園の一画に建立された。[関連外部サイトへのリンク集 ](https://www.gsi.go.jp/bousaichiri/denshouhi_links.html#hiroshima),34.383028,132.475183
34100-013,忘れまい大災害,2012,広島県広島市佐伯区五日市町大字上河内（河内公民館敷地内）,土石流（1999年6月29日）,土砂災害,平成11年(1999)6月29日に発生した6.29災害を受け、後世に災害を伝えるために建立された。また、これまでの災害についても記されている。[関連外部サイトへのリンク集 ](https://www.gsi.go.jp/bousaichiri/denshouhi_links.html#hiroshima),34.414419,132.354769
34100-014,広島土砂災害,2014,広島県広島市安佐南区祇園三丁目（祇園小学校敷地内）,平成26年8月豪雨（2014年8月20日）,土砂災害,平成26年(2014)8月20日に発生した土石流により地上から62ｃｍまで冠水したことを示す赤い線を碑に刻み、災害時の状況を後世に伝えている。[関連外部サイトへのリンク集 ](https://www.gsi.go.jp/bousaichiri/denshouhi_links.html#hiroshima),34.442666,132.463512
34100-015,土砂災害記念碑,2015,広島県広島市安佐南区緑井七丁目（緑井第八公園［八敷公園］内）,平成26年8月豪雨（2014年8月20日）,土砂災害,平成26年(2014)8月20日に発生した土石流により犠牲になった方の名前や民家の破壊という被害を後世に伝えるため、公園内に建立された。[関連外部サイトへのリンク集 ](https://www.gsi.go.jp/bousaichiri/denshouhi_links.html#hiroshima),34.474019,132.477361
34100-016,鎮魂の碑,2015,広島県広島市安佐南区八木三丁目（梅林集会所付近）,平成26年8月豪雨（2014年8月20日）,土砂災害,平成26年(2014)8月20日に発生した土砂災害に関する石碑で、周辺で犠牲になった方の名前が刻まれている。[関連外部サイトへのリンク集 ](https://www.gsi.go.jp/bousaichiri/denshouhi_links.html#hiroshima),34.481739,132.494039
34100-017,慰霊碑,2015,広島県広島市安佐南区八木三丁目（県営緑丘住宅敷地内）,平成26年8月豪雨（2014年8月20日）,土砂災害,平成26年(2014)8月20日に発生した土石流による県営緑丘住宅や小原山地区の犠牲者を弔うため建立。犠牲者の名前や豪雨の様子などが記されている。[関連外部サイトへのリンク集 ](https://www.gsi.go.jp/bousaichiri/denshouhi_links.html#hiroshima),34.480969,132.488019
34100-018,広島土砂災害　忘れまい8・20,2015,広島県広島市安佐南区八木三丁目（梅林小学校敷地内）,平成26年8月豪雨（2014年8月20日）,土砂災害,平成26年(2014)8月20日に発生した土石流による犠牲者への哀悼の意と、この災害が後世に伝わることを目的に建立されたことが記されている。[関連外部サイトへのリンク集 ](https://www.gsi.go.jp/bousaichiri/denshouhi_links.html#hiroshima),34.480181,132.491969
34100-019,広島豪雨災害記念碑 ,2015,広島県広島市安佐北区可部東六丁目（可部東第四公園内）,平成26年8月豪雨（2014年8月20日）,土砂災害,平成26年(2014)8月20日に発生した土石流による災害について、発生年月日などを碑の正面に刻み、被災の記憶を後世に伝えている。[関連外部サイトへのリンク集 ](https://www.gsi.go.jp/bousaichiri/denshouhi_links.html#hiroshima),34.516944,132.523575
34100-020,ぼうさい碑,2017,広島県広島市安佐北区三入三丁目（三入小学校敷地内）,平成26年8月豪雨（2014年8月20日）,土砂災害,平成26年(2014)8月20日に発生した土石流について、碑の正面に三入小学校の児童が作成したポスター、裏面に災害地図などを配置している。[関連外部サイトへのリンク集 ](https://www.gsi.go.jp/bousaichiri/denshouhi_links.html#hiroshima),34.538771,132.526895
34100-021,大禹謨（だいうぼ）,1972,広島市安佐南区八木二丁目（大禹謨公園内）,洪水（1943年他）,洪水,太田川流域は過去に何度も大洪水に見舞われており、特に承応2年(1653)の洪水では死者5000人余りに達したという。昭和18年（1943）の大出水は、旧八木村、旧川内村、旧緑井村の堤防が決壊し、濁流は全村に流れ込み、尊い人命と多くの財宝を奪った。[関連外部サイトへのリンク集 ](https://www.gsi.go.jp/bousaichiri/denshouhi_links.html#hiroshima),34.47897,132.498735
