ID,碑名,建立年,所在地,災害名,災害種別,伝承内容,緯度,経度
20451-001,遭難供養碑,1993,長野県東筑摩郡朝日村大字古見,雪崩（1933年3月16日）,その他,昭和8年（1933）の冬は、度重なる大雪で人家が埋めつくされるほどであった。3月16日午前11時頃、突然雪崩が発生し、山中で製炭の作業に従事していた人々を飲み込んだ。村民の救出活動も報われず、中俣沢で5名、船ヶ沢で1名の方が亡くなった。,36.102147,137.825763
20486-001,歳月茫茫（ぼうぼう）（幸田文文学碑）,1992,長野県北安曇郡小谷村大字中小谷,稗田山崩れ（1911年8月8日）,土砂災害,明治44年（1911）8月8日午前3時、突如として発生した稗田山の「抜け」と呼ばれる大規模な土砂崩壊により、死者23名、家屋田畑等約70ヘクタールが流失した。日本三大崩れのひとつと言われる大惨事であった。作家の幸田文は日本各地の崩壊現場に出向き、自分自身の眼でその傷跡を確かめ、当地での感慨も含め紀行文「崩れ」を発表した。1995年に土石流で流失後、翌年発見、再建された。,36.813607,137.892736
20486-002,歳月茫茫（ぼうぼう）（再建碑）,1996,長野県北安曇郡小谷村大字中小谷,平成7年7.11梅雨前線豪雨（1995年7月11日）,土砂災害,平成7年（1995）7月11日、梅雨前線による豪雨は、時間雨量48ミリ、最大日雨量357ミリの大雨となり、一瞬にして脆弱な地山を削り土石流となって流下し、人災は免れたものの、全壊家屋28棟を含む被災箇所数が1230にも及ぶ甚大な被害をもたらした。 隣接する「歳月茫茫」碑も西山斜面の崩壊により約80m流出し、埋没していたが、翌年発見され再建された。,36.81359,137.892666
20486-003,稗田山崩れて百年,2011,長野県北安曇郡小谷村大字中小谷,稗田山崩れ（1911年8月8日）,土砂災害,明治44年（1911）8月8日、突如として稗田山で大規模な山体崩壊が発生した。浦川沿いに流下した土砂は土石流となり、23名が亡くなった。土砂が姫川を塞いだため、上流側に天然ダム湖が形成され、湖の端部は3km上流まで達し、43戸が浸水した。一方、上流から流れ下った濁流は下流の来馬河原集落に流れ込み、役場をはじめ多くの民家や水田が埋没した。災害から100年の節目に当碑と慰霊碑（隣接）が建立された。,36.81356,137.892569
21202-001,今福堤防決壊の碑,不明,岐阜県大垣市今福町,洪水（1896年7・9月）,洪水,明治29年（1896）9月洪水による破堤災害を忘れないようにと、破堤口であるこの場所に建てられた。この地点は明治29年（1896）7月と9月の2回にわたって破堤し､また、文化12年(1815）にも破堤している。,35.312737,136.633327
21202-003,明治29年大洪水点,不明,岐阜県大垣市大垣城内,洪水（1896年7・9月）,洪水,明治29年（1896）の水害は大垣を中心とした輪中地域における最大の大水害であった。この年の7月19日より22日にかけて大垣では降水量378mmとなり各河川は増水して、21日に揖斐川にて今福が破堤し続いて水門川など46箇所で破堤して大水害となった。この災害復旧中の9月6日に台風が襲来して暴風雨となり、再び各河川で破堤して大風水害となった。9月の大垣の浸水は7月より約１メートル高く大垣町の約80パーセントの家々が屋根まで達する軒上浸水となった。,35.362076,136.615952
21206-001,災害復旧竣功記念碑,1965,岐阜県中津川市阿木,洪水（1957年6月27日、1961年6月28日）,洪水,昭和32年（1957）6月27日夜の集中豪雨で、阿木川及び寺川を中心として沿岸一帯は大洪水となり、阿木地区は死者7人、家屋流失5戸の被害を受けた。その復興途上の昭和36年（1961）6月28日、大豪雨により後田飯沼及び木戸ヶ入川が氾濫し、死者4人、家屋流失2戸の被害となった。,35.395446,137.463805
21206-002,昭和58年災害復旧記念,1986,岐阜県中津川市阿木,昭和58年台風10号（9.28災害）（1983年9月28日）,洪水・土砂災害,昭和58年（1983）9月28日、台風10号は雨台風となって中部地方を襲った。阿木地区では、阿木川を始め全ての河川が氾濫した。特に松沢川（下流飯沼川）では土石流が発生して死者1名、家屋数戸に土砂が流入、宮田地区で家屋損壊等の甚大な被害となった。,35.412131,137.483393
21208-001,小里川災害復旧之碑,1976,岐阜県瑞浪市土岐町市原,昭和47年7月豪雨（1972年7月12日）,洪水,昭和47年（1972）7月12日夜半から13日未明に、総雨量266.5oを記録した集中豪雨により、流域で氾濫が発生し、瑞浪市内で6名が死亡した。,35.367227,137.260497
21208-002,災害記念碑,1973,岐阜県瑞浪市陶町大川,昭和47年7月豪雨（1972年7月13日）,洪水,昭和47年（1972）7月13日未明に東濃三河地方を襲った集中豪雨は、大川盆地で死者5名、住家全壊4戸、半壊4戸、田畑流失2.5ヘクタールなどの被害をもたらした。隣接して、この災害で殉職した消防団員の殉職之碑が建立されている。,35.306433,137.291404
21209-001,震災紀念碑,1897,岐阜県羽島市竹鼻町下城（竹鼻別院）,濃尾地震（1891年10月28日）,地震,明治24年（1891）10月28日午前6時37分、岐阜県美濃地方を突然猛烈な地震が襲い、旧竹ヶ鼻町では死者268名、重傷者54名、軽症者283名、家屋全壊603戸、半壊5戸、火災634戸の被害が発生した。同町では火災の影響で、他の町村に比べても人口の割に死傷者がきわめて多かった。,35.323936,136.700875
21210-001,災害復旧記念碑,1977,岐阜県恵那市明智町,昭和47年7月豪雨（1972年7月13日）洪水（1974年7月10日）,洪水,昭和47年（1972）7月13日未明の集中豪雨で、旧明智町では明智川の増水による氾濫、山くずれ、溜め池の決壊、材木や倒木の流失による被害等のほか、死者行方不明者23名の被害となった。また、昭和49年（1974）7月10日午後には、前回に匹敵する雨量の豪雨となり、犠牲者1名の被害が発生した。,35.300989,137.388087
21210-002,災害慰霊碑,1974,岐阜県恵那市明智町大田,昭和47年7月豪雨（1972年7月13日）,洪水・土砂災害,昭和47年（1972）7月13日未明、東濃三河地方を襲った集中豪雨で、旧明智町で死者行方不明者23名の被害となり、ここ上田地区では死亡12名、家屋全壊10戸の被害が発生した。,35.300578,137.380573
21210-003,慰霊碑,1973,岐阜県恵那市明智町(千畳敷公園),昭和47年7月豪雨（1972年7月13日）伊勢湾台風（1959年9月26日）,洪水,昭和47年（1972）7月13日未明に襲った集中豪雨で旧明智町では21名の尊い人命が奪われ、また行方不明者の捜索中であった消防団員2名も濁流に飲まれて殉職した。さらに住家全壊43戸の甚大な被害をもたらした。昭和34年（1959）9月26日の伊勢湾台風では、28名が犠牲になったことも刻まれている。,35.299872,137.387096
21383-001,治水観音像,1978,岐阜県安八郡安八町大森地先,昭和51年台風17号（1976年9月12日）,洪水,昭和51年9月、台風17号の接近に伴い8日から雨が降り続き、11日には時間雨量約40mmとなり、12日午前10時28分に安八町大森の長良川右岸堤防が50mにわたって決壊した。安八町・墨俣町（現大垣市墨俣町）は泥海と化し、低いところは1階の天井まで水に浸かった。隣接して「長良川堤防破堤箇所」の碑が2006年に設置された。,35.323262,136.667966
21506-001,天心白菊の塔,1969,岐阜県加茂郡白川町河岐下山1279-6,昭和43年8.17豪雨災害（1968年8月17〜18日）,洪水・土砂災害,昭和43年(1968)8月17日夜半から18日未明に襲った集中豪雨で土石流が発生し、観光バス2台が巻き込まれ飛騨川へ転落、乗客乗員104名が犠牲となった。他にも中濃地方で14名の犠牲者を出した。,35.557322,137.184093
22100-001,災害復旧記念碑,1964,静岡県静岡市清水区和田島大向855-1（両河内生涯学習交流館前）,ダイナ台風（1952年6月23日）昭和33年台風11号（1958年7月23日）昭和34年台風7号（1959年8月14日）,洪水・土砂災害,昭和27年(1952)6月23日のダイナ台風は甚大な災害の爪痕を残した。復旧も大方完了した昭和33年(1958)7月23日の台風11号、昭和34年(1959)8月14日の台風7号にも襲われ、被害額は10億円余りに上った。,35.107203,138.477956
22100-002,災害復旧中河内川記念碑,1983,静岡県静岡市清水区中河内173-1,昭和54年台風20号（1979年10月19日）,洪水,昭和54年(1979)10月19日、季節外れの台風20号が興津川流域に吹き乱れ、かつてないほどの集中豪雨(294mm)となった。川は氾濫し、荒れ狂う濁流は田畑を押し流し、家屋に浸水し、道路や橋梁を破壊した。興津川支川の中河内川では家屋43棟が被害を受けた。,35.116123,138.483868
22100-003,有功堤碑,1893,静岡県静岡市葵区下1480（三十三身観音堂内）,洪水（1855年8月12日）,洪水,安倍川は、最上流の大谷崩れからの流出土砂が堆積し、急流河川でもあるため、大雨により洪水・氾濫被害が発生しやすい。有功堤は仮定（ヒジマガリ）という構造により水の勢いを弱める仕組みの堤防であるが、安政2年6月30日(1855年8月12日)の大洪水により決壊し、流域に多大な被害を与えた。明治7年（1874）に元の堤防に復旧して以来、一度も水害がなくなった。,35.030923,138.376182
22100-004,安倍川修堤碑,1924,静岡県静岡市葵区柳町161-2,大正3年の台風（1914年8月29日）,洪水,"大正3年(1914)8月29日午後、台風の影響により安倍川堤防が安西五丁目で決壊し、浸水は安西一帯・番町・寺町・新通・宮ヶ崎・馬場町・呉服町・研屋町・栄町・梅屋町・人宿町に及んだ。約1,000戸が流失、約10,000戸が浸水し、死者45人、負傷者90人。日雨量は大河内で474mm、大川で402mmであった。",34.983159,138.363844
22100-005,慰霊碑,1968,静岡県静岡市葵区梅ヶ島5264-1地先,昭和41年台風26号（1966年9月25日）,洪水・土砂災害,昭和41年(1966)9月25日、台風26号の豪雨による被害は静岡県全域に及び、特に静岡県中部で被害が大きかった。葵区梅ヶ島で24日の日雨量が312mmの豪雨があり、25日0時頃に安倍川で土石流が発生して梅ヶ島温泉街で氾濫し、家屋全壊9戸、半壊2戸、死者26名の被害となった。,35.306383,138.337811
22100-006,七夕災害慰霊碑,1977,静岡県静岡市葵区丸山町26-2,昭和49年台風8号（七夕豪雨）（1974年7月7日）,洪水,"昭和49年(1974)7月7日、七夕豪雨と呼ばれる台風8号の被害は静岡県全域に及び、静岡市の2日雨量は508mmに達した。旧静岡市と旧清水市で死者24人、床上浸水16,197戸、床下浸水24,339戸もの被害を受けた。",34.986478,138.376054
22100-007,建設省安倍川砂防五十周年記念碑,1987,静岡県静岡市葵区梅ヶ島4198-2地先,昭和41年台風26号（1966年9月25日）昭和57年台風10号（1982年7月31日〜8月3日）,洪水・土砂災害,安倍川上流域は大谷崩をはじめ、多くの山腹崩壊による災害に見舞われ、昭和41年9月、昭和57年8月など大きな土砂災害が発生した。特に昭和41年(1966)9月25日には、台風26号による豪雨で、安倍川で発生した土石流が梅ヶ島温泉街で氾濫し、家屋全壊9戸、半壊2戸、死者26名の被害となった。,35.265143,138.329684
22100-008,有東木沢災害復興之碑,1985,静岡県静岡市葵区有東木（有東木バス停横）,昭和57年台風10号（1982年8月2日）,洪水,昭和57年(1982)8月2日、台風10号の豪雨被害は静岡県下に及び、山間部を中心に日雨量400mm程度の降雨を記録した。橋の流失などで道路が寸断、数日間にわたり梅ヶ島地区、井川地区が孤立した。有東木沢は濁流となり、茶畑やわさび田が押し流され、道路・橋梁が破壊される被害となった。,35.207375,138.368849
22203-001,震災追弔の碑,1903,静岡県沼津市大岡3224-4,安政東海地震（1854年12月23日）,地震,嘉永7年11月4日（1854年12月23日）に発生した安政東海地震により、駿河国大岡村（現沼津市大岡南小林）の約2haほどの土地が一瞬のうちに約12〜15m陥没して、住家12戸が埋没、9名が亡くなった。,35.128322,138.887068
22203-002,七夕豪雨慰霊の碑,1976,静岡県沼津市獅子浜字上の山307−19,七夕豪雨・土砂崩れ（1974年7月8日）,土砂災害,昭和49年（1974）7月8日未明、通称七夕豪雨により沼津市獅子浜地区の住宅の裏山（上の山）で土砂崩れが発生し、住宅3棟が全壊、4名が亡くなった。,35.054093,138.885577
22203-003,妙法　横難死亡供養　霊塔,1763,静岡県沼津市内浦長浜字北丁94,「未の荒」大雨・土砂崩れ（1751年6月26日（旧暦））,土砂災害,寛延4年6月26日(1751年）、伊豆地方を襲った豪雨（「未の荒」）により、伊豆国長浜村（現沼津市内浦長浜）住本寺の裏山が崩れ、堂宇をはじめ住家が流され、住職と共に村人32名が犠牲となった。,35.017755,138.894852
22203-004,洪水紀念表,1908,静岡県沼津市大平字外新城,洪水（寛政3年8月、安政6年7月25日、1890年8月23日、1907年8月24日）,洪水,狩野川左岸に位置する駿河国大平村（現沼津市大平）において、寛政3年（1791）8月、安政6年7月25日（1859年）、明治23年（1890）8月23日、明治40年（1907）8月24日に大水害が起きた。碑は元は狩野川の水際にあったもので、左右には目盛りが刻まれている。,35.074669,138.91617
22203-005,昭和十三年戌寅年大洪水記念之碑,1942,静岡県沼津市戸田字御園尾1585,昭和13年水害（1938年6月29日）,洪水,昭和13年6月29日、台風による大雨によって戸田村戸田地区（現沼津市戸田）の大川の堤防が決壊し大洪水が発生した。戸田地区の多数の家屋が浸水し、水田約65haが冠水した。,34.970947,138.791437
22203-006,昭和十三年十六年大水害復旧記念碑,1946,静岡県沼津市戸田字御園尾1585,昭和13年水害（1938年6月29日）　昭和16年水害（1941年7月21日）,洪水,昭和13年、16年の水害からの復旧記念碑。昭和16年7月12日に、戸田村戸田地区（現沼津市戸田）の大川が氾濫し、全壊5棟、橋流出などの大被害をもたらした。,34.970977,138.791437
22203-007,災害復興記念碑,1964,静岡県沼津市戸田字御園尾,昭和36年梅雨前線豪雨（1961年6月28日）,洪水,昭和36年6月28日の集中豪雨による水害からの復旧記念碑。昭和36年6月28日、梅雨前線による集中豪雨で戸田村戸田地区（現沼津市戸田）の大川が氾濫し、124haが浸水。当時の村約半分の世帯が浸水した。,34.971007,138.791437
22208-001,元禄地震津波供養塔（行蓮寺）,1763,静岡県伊東市宇佐美（行蓮寺）,寛永小田原地震(1633年3月1日)元禄地震（1703年12月31日）,地震・津波,元禄地震津波の被害から60回忌を迎えた宝暦13年（1763）に宇佐美地区の住民が建立した供養塔である。碑文中には元禄16年11月23日（1703年12月31日）発生の元禄地震津波による死者380人余と流失家屋300戸などの被害が記され、寛永10年1月21日発生の小田原地震による津波の模様と被災状況が伺える。,35.008733,139.086682
22208-002,元禄地震津波供養塔（仏現寺）,不明,静岡県伊東市物見が丘（仏現寺）,元禄地震（1703年12月31日）,地震・津波,元禄16年11月23日（1703年12月31日）未明に発生した元禄地震で、旧和田村では、地震と津波で死者163人、多数の家屋が流失した。現在、元禄地震の碑は2基並んでいるが、向かって右側の碑は、玖須美海岸近くにあったものをこの地に移設した。1923年の関東大震災の碑に隣接する。,34.967041,139.102914
22208-003,元禄地震津波供養塔（恵鏡院）,不明,静岡県伊東市川奈（恵鏡院）,元禄地震（1703年12月31日）,地震・津波,元禄16年11月23日（1703年12月31日）未明に発生した元禄地震で、旧川奈村では、地震と津波で死者200人余りの被害となった。碑は旧川奈村内の林光院にあったものをこの地に移設した。,34.951319,139.127059
22208-004,大正12年関東大震災つなみ浸水地点,不明,静岡県伊東市宇佐美（行蓮寺）,関東大震災（1923年9月1日）,地震・津波,大正12年（1923）9月1日午前11時58分に発生した関東大震災では、強い揺れにより家屋や橋梁が倒壊し、沿岸を高さ約5m（石碑の地点は標高4.7m）の津波が二度にわたって襲った。旧宇佐美村では家屋全壊33戸、半壊67戸、家屋流失111戸の被害となった。碑はそのときの津波到達点を示している。,35.008644,139.086877
22208-005,大正12年関東大震災つなみ浸水地点,不明,静岡県伊東市宇佐美,関東大震災（1923年9月1日）,地震・津波,大正12年（1923）9月1日午前11時58分に発生した関東大震災では、強い揺れにより家屋や橋梁が倒壊し、沿岸を高さ5m前後（石碑の地点は標高4.8m）の津波が二度にわたって襲った。旧宇佐美村では家屋全壊33戸、半壊67戸、家屋流失111戸の被害となった。碑はそのときの津波到達点を示している。,35.006456,139.083511
22208-006,大正12年関東大震災つなみ浸水地点,1986,静岡県伊東市宇佐美（春日神社）,関東大震災（1923年9月1日）,地震・津波,大正12年（1923）9月1日午前11時58分に発生した関東大震災では、強い揺れにより家屋や橋梁が倒壊し、沿岸を高さ5m前後（石碑の地点は標高5.6m）の津波が二度にわたって襲った。旧宇佐美村では家屋全壊33戸、半壊67戸、家屋流失111戸の被害となった。碑はそのときの津波到達点を示している。,35.002334,139.081712
22208-007,供養塔・大震災殃死者供養塔（五輪塔）,1924,静岡県伊東市物見が丘（仏現寺）,関東大震災（1923年9月1日）,地震・津波,大正12年（1923）9月1日午前11時58分に発生した関東大震災で、旧伊東町は強い揺れの十数分後に大津波に襲われ、玖須美地区で死者84名、後に他所や数日後の死者を含め105名の被害となった。供養塔には「九月一日ヲ忘レルナ」、大地震の際は火の元用心を第一に、助け合って安全な高地に避難すべしと教訓が記されている。1703年の元禄津波の供養碑に隣接する。,34.967061,139.102934
22208-008,大正十二年関東大震災つなみ浸水点,1987,静岡県伊東市和田二丁目,関東大震災（1923年9月1日）,地震・津波,大正12年（1923）9月1日午前11時58分に発生した関東大震災では、強い揺れにより家屋や橋梁が倒壊し、沿岸を高さ4m弱（石碑の地点は標高3.9m）の津波が二度にわたって襲った。旧伊東町では死者79人、行方不明30人、家屋全壊219戸、半壊392戸、流失294戸の被害となった。碑はそのときの津波到達点を示している。,34.96905,139.102162
22208-009,大正十二年関東大震災つなみ浸水点,1987,静岡県伊東市和田一丁目,関東大震災（1923年9月1日）,地震・津波,大正12年（1923）9月1日午前11時58分に発生した関東大震災では、強い揺れにより家屋や橋梁が倒壊し、沿岸を高さ4m弱（石碑の地点は標高3.9m）の津波が二度にわたって襲った。旧伊東町では死者79人、行方不明30人、家屋全壊219戸、半壊392戸、流失294戸の被害となった。碑はそのときの津波到達点を示している。,34.968821,139.100483
22208-010,大正十二年関東大震災つなみ浸水点,1988,静岡県伊東市芝町,関東大震災（1923年9月1日）,地震・津波,大正12年（1923）9月1日午前11時58分に発生した関東大震災では、強い揺れにより家屋や橋梁が倒壊し、沿岸を高さ5m強（石碑の地点は標高5.5m）の津波が二度にわたって襲った。旧伊東町では死者79人、行方不明30人、家屋全壊219戸、半壊392戸、流失294戸の被害となった。碑はそのときの津波到達点を示している。,34.968579,139.105986
22208-011,大正十二年関東大震災つなみ浸水点,1987,静岡県伊東市竹の内一丁目,関東大震災（1923年9月1日）,地震・津波,大正12年（1923）9月1日午前11時58分に発生した関東大震災では、強い揺れにより家屋や橋梁が倒壊し、沿岸を高さ4m弱（石碑の地点は標高3.9m）の津波が二度にわたって襲った。旧伊東町では死者79人、行方不明30人、家屋全壊219戸、半壊392戸、流失294戸の被害となった。碑はそのときの津波到達点を示している。,34.969737,139.097213
22208-012,大正十二年関東大震災つなみ浸水点,1987,静岡県伊東市川奈（海蔵寺）,関東大震災（1923年9月1日）,地震・津波,大正12年（1923）9月1日午前11時58分に発生した関東大震災では、強い揺れにより家屋や橋梁が倒壊し、川奈地区を5m強（石碑の地点は標高5.2m）の津波が襲った。川奈地区で58棟が流失、死者3名の被害となり、碑はそのときの津波到達点を示している。同じ石段沿いには、元禄地震（1703）と安政東海地震(1854)の「つなみ浸水点」の碑もある。,34.951263,139.131508
22208-013,大正十二年関東大震災つなみ浸水点,1988,静岡県伊東市富戸,関東大震災（1923年9月1日）,地震・津波,大正12年（1923）9月1日午前11時58分に発生した関東大震災で、富戸地区では7m強（石碑の地点は標高7.7m）の津波が襲ってきた。富戸地区では船舶の流失被害はあったが家屋等の被害はなかった。碑はそのときの津波到達点を示している。,34.883561,139.131294
22208-014,大正十二年関東大震災つなみ浸水点,1988,静岡県伊東市八幡野,関東大震災（1923年9月1日）,地震・津波,大正12年（1923）9月1日午前11時58分に発生した関東大震災で、八幡野地区では5m強（石碑の地点は標高5.7m）の津波が襲ってきた。八幡野地区では船舶の流失被害はあったが家屋等の被害はなかった。碑はそのときの津波到達点を示している。,34.869613,139.101741
22208-015,大正十二年関東大震災つなみ浸水点,1988,静岡県伊東市川奈,関東大震災（1923年9月1日）,地震・津波,大正12年（1923）9月1日午前11時58分に発生した関東大震災では、強い揺れにより家屋や橋梁が倒壊し、川奈地区を5m強（石碑の地点は標高5.6m）の津波が襲った。川奈地区で58棟が流失、死者3名の被害となり、碑はそのときの津波到達点を示している。,34.949978,139.134378
22209-001,慰霊塔,1966,静岡県島田市伊久美,洪水・土砂災害（1960年8月13日）,洪水・土砂災害,昭和35年（1960）8月13日、一週間降り続いた雨は600mmを超え、午後8時30分頃に大規模な土石流が発生した。土砂は白井地区を襲い、2軒の民家をのみ込み、16名の尊い命が奪われた。また、この雨の影響で伊久美川に流れ込む雨水は行き場をなくし、伊久美地区では全ての橋梁が流失するなど、下流でも洪水の被害に見舞われた。,34.966907,138.157078
22210-001,水難記念碑,1940,静岡県富士市宮下（宮下山神社）,明治43年の大水害（1910年8月9日）,洪水,明治43年（1910）8月9日午後9時、台風による大雨で富士川の堤防が500メートル以上決壊し、宮下地区では家屋の流失10戸、半壊15戸、田畑は35ヘクタールが砂礫と化した。住民は高所にあった山神社境内へ避難したため、人的被害は免れた。,35.142053,138.638467
